{
  "adapter_id": "connector.python_stdlib.sqlite3.github_actions.v1",
  "conformance_receipts": [
    {
      "artifact_ref": "receipt.source.sqlite_embedded.918429aaf09bca8d",
      "executed_at": "2026-08-27T16:26:48.257035Z",
      "result": "pass",
      "test_id": "verify.sqlite.journal_mode_wal"
    },
    {
      "artifact_ref": "receipt.source.sqlite_embedded.918429aaf09bca8d",
      "executed_at": "2026-08-27T16:26:48.257035Z",
      "result": "pass",
      "test_id": "verify.sqlite.schema_and_key_discovery"
    },
    {
      "artifact_ref": "receipt.source.sqlite_embedded.918429aaf09bca8d",
      "executed_at": "2026-08-27T16:26:48.257035Z",
      "result": "pass",
      "test_id": "verify.sqlite.repeatable_read_basic"
    },
    {
      "artifact_ref": "receipt.source.sqlite_embedded.918429aaf09bca8d",
      "executed_at": "2026-08-27T16:26:48.257035Z",
      "result": "pass",
      "test_id": "verify.sqlite.transaction_rollback_atomicity"
    },
    {
      "artifact_ref": "receipt.source.sqlite_embedded.918429aaf09bca8d",
      "executed_at": "2026-08-27T16:26:48.257035Z",
      "result": "pass",
      "test_id": "verify.sqlite.snapshot_cut_stability"
    },
    {
      "artifact_ref": "receipt.source.sqlite_embedded.918429aaf09bca8d",
      "executed_at": "2026-08-27T16:26:48.257035Z",
      "result": "pass",
      "test_id": "verify.sqlite.hard_delete_observable"
    },
    {
      "artifact_ref": "receipt.source.sqlite_embedded.918429aaf09bca8d",
      "executed_at": "2026-08-27T16:26:48.257035Z",
      "result": "pass",
      "test_id": "verify.sqlite.schema_evolution_discoverable"
    },
    {
      "artifact_ref": "receipt.source.sqlite_embedded.918429aaf09bca8d",
      "executed_at": "2026-08-27T16:26:48.257035Z",
      "result": "pass",
      "test_id": "verify.sqlite.integrity_check"
    }
  ],
  "delivery": {
    "backfill": "full table scan",
    "checkpoint": "transaction snapshot only; no durable CDC checkpoint qualified",
    "deduplication": "caller key/idempotency required",
    "guarantee": "transactional reads/writes for tested scope",
    "ordering_scope": "database transaction / statement order",
    "replay": "query from retained database state only",
    "resume": "reopen database and new transaction",
    "transaction_boundary": "SQLite database transaction"
  },
  "license": {
    "redistribution": "not adjudicated by this receipt",
    "spdx_or_policy": "Python-2.0 for CPython; SQLite public-domain project posture requires separate legal interpretation",
    "support_status": "test-harness reference adapter only"
  },
  "limits": {
    "concurrency": "not benchmarked",
    "page": {
      "failure_behavior": "invalid/unsupported pragma or database corruption",
      "observed_at": "2026-08-27T16:26:48.257035Z",
      "scope": "database page",
      "source": "capability_probe",
      "unit": "bytes",
      "value": 4096
    },
    "payload": "not benchmarked",
    "query_cost": "not benchmarked",
    "quota": "deployment specific",
    "rate": "not benchmarked",
    "retention": "operator/filesystem specific"
  },
  "observability": {
    "dead_letter": "none",
    "health": "PRAGMA integrity_check",
    "lineage": "receipt + occurrence + chain identities",
    "logs": "GitHub Actions log",
    "metrics": "probe-local only",
    "owner": "shannon-insight B08 research harness",
    "retry": "typed SQLite exception handling required",
    "runbook": "reference harness only",
    "traces": "none"
  },
  "operations": {
    "change": [
      "WAL observation",
      "schema reinspection"
    ],
    "discovery": [
      "PRAGMA table_info"
    ],
    "read": [
      "query",
      "scan",
      "transaction snapshot"
    ],
    "write": [
      "insert",
      "delete",
      "alter table",
      "transaction"
    ]
  },
  "protocol": "CPython sqlite3 DB-API binding to SQLite",
  "schema": {
    "compatibility": "application-specific and unqualified",
    "deprecation": "not qualified",
    "discovery": "PRAGMA table_info",
    "drift": "reinspect schema",
    "inference": "declared SQLite schema only",
    "unknown_fields": "fail closed in governed mapping"
  },
  "security": {
    "audit": "probe receipt only",
    "authentication": "process/filesystem boundary",
    "authorization": "OS file permission only in this occurrence",
    "credential_reference_only": true,
    "encryption": "not asserted",
    "network_boundary": "no network listener",
    "secret_rotation": "not applicable to local synthetic file"
  },
  "source_class_ids": [
    "source.operational_database.embedded_relational"
  ],
  "temporal": {
    "cursor_time": "transaction-local",
    "event_time": "not intrinsic",
    "late_data": "not intrinsic",
    "recorded_time": "commit order only",
    "revision": "new committed state",
    "tombstone": "hard delete tested; tombstone semantics absent",
    "watermark": "none"
  },
  "versions": {
    "implementation": "CPython 3.12.14 sqlite3 / SQLite 3.45.1",
    "maximum_tested_source": "3.45.1",
    "minimum_source": "not established",
    "protocol": "Python DB-API 2.0 sqlite3 module surface"
  }
}
